{
  "$schema": "https://json-schema.org/draft/2020-12/schema",
  "$id": "https://github.com/openvex/spec/openvex_json_schema_0.2.0.json",
  "$comment": "Derived from openvex/spec openvex_json_schema.json at commit a68ccd19b15a9604d28ef66ebf33f27a772ba4ec (Apache-2.0).",
  "title": "OpenVEX",
  "description": "OpenVEX is an implementation of the Vulnerability Exploitability Exchange (VEX for short) that is designed to be minimal, compliant, interoperable, and embeddable.",
  "type": "object",
  "$defs": {
    "vulnerability": {
      "type": "object",
      "properties": {
        "@id": {
          "type": "string",
          "format": "iri"
        },
        "name": {
          "type": "string"
        },
        "description": {
          "type": "string"
        },
        "aliases": {
          "type": "array",
          "uniqueItems": true,
          "items": {
            "type": "string"
          }
        }
      },
      "required": [
        "name"
      ],
      "additionalProperties": false
    },
    "identifiers": {
      "type": "object",
      "properties": {
        "purl": {
          "type": "string"
        },
        "cpe22": {
          "type": "string"
        },
        "cpe23": {
          "type": "string"
        }
      },
      "additionalProperties": false,
      "anyOf": [
        {
          "required": [
            "purl"
          ]
        },
        {
          "required": [
            "cpe22"
          ]
        },
        {
          "required": [
            "cpe23"
          ]
        }
      ]
    },
    "hashes": {
      "type": "object",
      "properties": {
        "md5": {
          "type": "string"
        },
        "sha1": {
          "type": "string"
        },
        "sha-256": {
          "type": "string"
        },
        "sha-384": {
          "type": "string"
        },
        "sha-512": {
          "type": "string"
        },
        "sha3-224": {
          "type": "string"
        },
        "sha3-256": {
          "type": "string"
        },
        "sha3-384": {
          "type": "string"
        },
        "sha3-512": {
          "type": "string"
        },
        "blake2s-256": {
          "type": "string"
        },
        "blake2b-256": {
          "type": "string"
        },
        "blake2b-512": {
          "type": "string"
        }
      },
      "additionalProperties": false
    },
    "subcomponent": {
      "type": "object",
      "properties": {
        "@id": {
          "type": "string",
          "format": "iri"
        },
        "identifiers": {
          "$ref": "#/$defs/identifiers"
        },
        "hashes": {
          "$ref": "#/$defs/hashes"
        }
      },
      "additionalProperties": false,
      "anyOf": [
        {
          "required": [
            "@id"
          ]
        },
        {
          "required": [
            "identifiers"
          ]
        }
      ]
    },
    "component": {
      "type": "object",
      "properties": {
        "@id": {
          "type": "string",
          "format": "iri"
        },
        "identifiers": {
          "$ref": "#/$defs/identifiers"
        },
        "hashes": {
          "$ref": "#/$defs/hashes"
        },
        "subcomponents": {
          "type": "array",
          "uniqueItems": true,
          "items": {
            "$ref": "#/$defs/subcomponent"
          }
        }
      },
      "additionalProperties": false,
      "anyOf": [
        {
          "required": [
            "@id"
          ]
        },
        {
          "required": [
            "identifiers"
          ]
        }
      ]
    }
  },
  "properties": {
    "@context": {
      "type": "string",
      "format": "uri"
    },
    "@id": {
      "type": "string",
      "format": "iri"
    },
    "author": {
      "type": "string"
    },
    "role": {
      "type": "string"
    },
    "timestamp": {
      "type": "string",
      "format": "date-time"
    },
    "last_updated": {
      "type": "string",
      "format": "date-time"
    },
    "version": {
      "type": "integer",
      "minimum": 1
    },
    "tooling": {
      "type": "string"
    },
    "statements": {
      "type": "array",
      "uniqueItems": true,
      "minItems": 1,
      "items": {
        "type": "object",
        "properties": {
          "@id": {
            "type": "string",
            "format": "iri"
          },
          "version": {
            "type": "integer",
            "minimum": 1
          },
          "vulnerability": {
            "$ref": "#/$defs/vulnerability"
          },
          "timestamp": {
            "type": "string",
            "format": "date-time"
          },
          "last_updated": {
            "type": "string",
            "format": "date-time"
          },
          "products": {
            "type": "array",
            "uniqueItems": true,
            "items": {
              "$ref": "#/$defs/component"
            }
          },
          "status": {
            "type": "string",
            "enum": [
              "not_affected",
              "affected",
              "fixed",
              "under_investigation"
            ]
          },
          "supplier": {
            "type": "string"
          },
          "status_notes": {
            "type": "string"
          },
          "justification": {
            "type": "string",
            "enum": [
              "component_not_present",
              "vulnerable_code_not_present",
              "vulnerable_code_not_in_execute_path",
              "vulnerable_code_cannot_be_controlled_by_adversary",
              "inline_mitigations_already_exist"
            ]
          },
          "impact_statement": {
            "type": "string"
          },
          "action_statement": {
            "type": "string"
          },
          "action_statement_timestamp": {
            "type": "string",
            "format": "date-time"
          }
        },
        "required": [
          "vulnerability",
          "status"
        ],
        "additionalProperties": false,
        "allOf": [
          {
            "if": {
              "properties": {
                "status": {
                  "const": "not_affected"
                }
              }
            },
            "then": {
              "anyOf": [
                {
                  "required": [
                    "justification"
                  ]
                },
                {
                  "required": [
                    "impact_statement"
                  ]
                }
              ]
            }
          },
          {
            "if": {
              "properties": {
                "status": {
                  "const": "affected"
                }
              }
            },
            "then": {
              "required": [
                "action_statement"
              ]
            }
          }
        ]
      }
    }
  },
  "required": [
    "@context",
    "@id",
    "author",
    "timestamp",
    "version",
    "statements"
  ],
  "additionalProperties": false
}
