{
  "@context": "https://openvex.dev/ns/v0.2.0",
  "@id": "https://github.com/microsoft/azure-nvidia-robotics-reference-architecture/security/vex/dataviewer-base/2026-04-25",
  "author": "Microsoft physical-AI-toolchain maintainers",
  "role": "document creator",
  "timestamp": "2026-04-25T00:00:00Z",
  "version": 1,
  "statements": [
    {
      "vulnerability": {
        "name": "CVE-2023-45853",
        "description": "MiniZip in zlib through 1.3 has an integer overflow and resultant heap-based buffer overflow in zipOpenNewFileInZip4_64 via a long filename, comment, or extra field."
      },
      "products": [
        {
          "@id": "pkg:oci/dataviewer-backend?repository_url=ghcr.io/microsoft/azure-nvidia-robotics-reference-architecture"
        },
        {
          "@id": "pkg:oci/dataviewer-frontend?repository_url=ghcr.io/microsoft/azure-nvidia-robotics-reference-architecture"
        }
      ],
      "status": "not_affected",
      "justification": "vulnerable_code_not_in_execute_path",
      "impact_statement": "The dataviewer backend (FastAPI/Uvicorn on python:3.12-slim) and frontend (nginx:1.29-alpine serving a static React bundle) do not invoke MiniZip's zipOpenNewFileInZip4_64 entry point. The vulnerable code path is reachable only when applications create ZIP archives via MiniZip; dataviewer reads parquet/MCAP/JSON datasets and does not produce ZIP output."
    }
  ]
}
